{
  "oamp_version": "1.2.0",
  "type": "knowledge_store",
  "user_id": "user-alice-123",
  "entries": [
    {
      "oamp_version": "1.0.0",
      "type": "knowledge_entry",
      "id": "550e8400-e29b-41d4-a716-446655440090",
      "user_id": "user-alice-123",
      "category": "preference",
      "content": "User prefers concise summaries for approval queues.",
      "confidence": 0.88,
      "source": {
        "session_id": "sess-2026-05-01-001",
        "timestamp": "2026-05-01T08:00:00Z"
      },
      "tags": ["communication"]
    },
    {
      "oamp_version": "1.2.0",
      "type": "knowledge_entry",
      "id": "550e8400-e29b-41d4-a716-446655440100",
      "user_id": "user-alice-123",
      "category": "fact",
      "content": "User can approve payroll exports but cannot approve vendor onboarding.",
      "confidence": 0.91,
      "source": {
        "session_id": "sess-2026-05-07-001",
        "timestamp": "2026-05-07T10:00:00Z"
      },
      "provenance": {
        "sources": [
          {
            "session_id": "sess-2026-05-07-001",
            "timestamp": "2026-05-07T10:00:00Z",
            "turn_id": "turn-3"
          },
          {
            "session_id": "sess-2026-05-07-002",
            "timestamp": "2026-05-07T10:05:00Z",
            "turn_id": "turn-4"
          }
        ],
        "derived": true
      },
      "governance": {
        "sensitivity_class": "confidential",
        "labels": ["finance", "payroll"],
        "handling": {
          "retrieval": "governed",
          "export": "governed",
          "stream": "governed"
        }
      },
      "tags": ["access-control", "finance"]
    },
    {
      "oamp_version": "1.2.0",
      "type": "knowledge_entry",
      "id": "550e8400-e29b-41d4-a716-446655440101",
      "user_id": "user-alice-123",
      "category": "pattern",
      "content": "User usually batches payroll and vendor review tasks into a single Friday workflow.",
      "confidence": 0.82,
      "source": {
        "session_id": "sess-2026-05-08-001",
        "timestamp": "2026-05-08T09:00:00Z"
      },
      "provenance": {
        "sources": [
          {
            "session_id": "sess-2026-05-08-001",
            "timestamp": "2026-05-08T09:00:00Z",
            "turn_id": "turn-5"
          }
        ],
        "derived": false
      },
      "tags": ["workflow", "finance"]
    }
  ],
  "exported_at": "2026-05-08T09:30:00Z",
  "agent_id": "interop-fixture-pack"
}
